<?xml version="1.0" standalone="no"?>
<!-- <!DOCTYPE jlanserver SYSTEM "jlanserver.dtd"> -->

<jlanserver>
  <servers>
    <SMB/>
    <FTP/>
    <NFS/>
  </servers>
	
  <SMB>
    <host name="JLANSRV" domain="ALFRESCO">
      <broadcast>192.168.1.255</broadcast>
      <smbdialects>LanMan,NT</smbdialects>
      <comment>Alfresco JLAN Server</comment>

      <Win32NetBIOS/>
      <Win32Announce interval="5"/>
      
      <!-- Requires running the server using the root account -->
      <netBIOSSMB sessionPort="1139" namePort="1137" datagramPort="1138" platforms="linux,macosx,solaris"/>
      <tcpipSMB port="1445" platforms="linux,macosx,solaris"/>

      <!-- To run the server using a non-root account on linux, Mac OS X, Solaris -->
      <!--
      <netBIOSSMB sessionPort="1139" namePort="1137" datagramPort="1138" platforms="linux,macosx,solaris"/>
      <tcpipSMB port="1445" platforms="linux,macosx,solaris"/>
      -->
      
      <hostAnnounce interval="5"/>
      <!-- <sessionTimeout>15</sessionTimeout> -->
    </host>
    <sessionDebug flags="Negotiate,Socket,IPC"/>
	  
<!--    <netbiosDebug/> -->
<!--    <announceDebug/> -->
    
	<authenticator type="enterprise">
<!--
				<KDC>192.168.1.240</KDC>
        <Realm>WIN2003.STARLASOFT.CO.UK</Realm>
        <Password>Autobahn79</Password>
          
        <kerberosDebug/>

		<disableNTLM/>
-->		

		<mode>USER</mode>
		<NOallowGuest/>

	    <Debug/>
	</authenticator>
    
  </SMB>

  <FTP>
    <port>1121</port>
    <NOallowAnonymous/>
    <debug flags="File,Search,Error,DataPort,Directory,RxData,TxData,SSL"/>
	  
	<!-- Enable FTPS -->
    <keyStore>/Users/gkspencer/testKeystore</keyStore>
	<trustStore>/Users/gkspencer/testTruststore</trustStore>
	<storePassphrase>Roboter79</storePassphrase>
	<NOrequireSecureSession/>
	<sslEngineDebug/>
  </FTP>
	
  <NFS>
    <NOenablePortMapper/>
    <debug flags="Session,Error,File,FileIO"/>
  </NFS>

  <debug>
    <output>
      <class>org.alfresco.jlan.debug.ConsoleDebug</class>
      <logFile>jlansrv.log</logFile>
      <append/>
    </output>
  </debug>

  <shares>
    <diskshare name="JLAN" comment="Test share">
      <driver>
        <class>org.alfresco.jlan.smb.server.disk.JavaFileDiskDriver</class>
        <LocalPath>.</LocalPath>
      </driver>
    </diskshare>
	  
	<diskshare name="DerbyBlob" comment="Derby JDBC virtual filesystem using BLOB">
		<driver>
			<class>org.alfresco.jlan.server.filesys.db.DBDiskDriver</class>
			<CacheTime>30</CacheTime>
			<!-- <RetentionPeriod>7</RetentionPeriod> -->
			<NODebug/>
        
			<DatabaseInterface>
				<class>org.alfresco.jlan.server.filesys.db.derby.DerbyDBInterface</class>
				<DSN>jdbc:derby:DerbyBlobDB;create=true</DSN>
				<Username>gkspencer</Username>
				<Password>roboter</Password>
				<ConnectionPool>10:20</ConnectionPool>
				<NODebug/>
				<NOSQLDebug/>
			</DatabaseInterface>
        
			<FileLoader>
				<class>org.alfresco.jlan.server.filesys.db.DBFileLoader</class>
				<ThreadPoolSize>6:2</ThreadPoolSize>
				<TempDirectory>/Volumes/Data/JLAN/DerbyTemp</TempDirectory>
				<MaximumFilesPerDirectory>1000</MaximumFilesPerDirectory>

<!--
				<SmallFileSize>100K</SmallFileSize>
				<FilesPerJar>500</FilesPerJar>
				<SizePerJar>1000K</SizePerJar>
				<JarCompressionLevel>9</JarCompressionLevel>
-->      
				<Debug/>
				<NOThreadDebug/>
			</FileLoader>
		</driver>

		<size totalSize="5G"/>
<!--		
		<accessControl default="Write">
			<domain name="STARLASOFT" access="Write"/>
			<user name="gkspencer" access="Write"/>
			<gid id="101" access="Read"/>
			<uid id="102" access="Read"/>
			<address subnet="192.168.1.255" mask="255.255.255.0" access="Read"/>
			<address ip="192.168.1.2" access="Write"/>
			<protocol type="CIFS" access="Read"/>
		</accessControl>
-->		
	</diskshare>

<!--	  	  
	<diskshare name="DerbyObjId" comment="Derby JDBC virtual filesystem using object id loader">
		<driver>
			<class>org.alfresco.jlan.server.filesys.db.DBDiskDriver</class>
			<CacheTime>30</CacheTime>
			<Debug/>
        
			<DatabaseInterface>
				<class>org.alfresco.jlan.server.filesys.db.derby.DerbyDBInterface</class>
				<DSN>jdbc:derby:DerbyObjIdDB;create=true</DSN>
				<Username>gkspencer</Username>
				<Password>roboter</Password>
				<ConnectionPool>10:20</ConnectionPool>
				<Debug/>
				<noSQLDebug/>
			</DatabaseInterface>
        
			<FileLoader>
				<class>org.alfresco.jlan.server.filesys.db.DummyObjectIdFileLoader</class>
				<ThreadPoolSize>6:2</ThreadPoolSize>
				<TempDirectory>/Volumes/Data/JLAN/DerbyObjTemp</TempDirectory>
				<MaximumFilesPerDirectory>1000</MaximumFilesPerDirectory>

				<SmallFileSize>100K</SmallFileSize>
				<FilesPerJar>500</FilesPerJar>
				<SizePerJar>1000K</SizePerJar>
				<JarCompressionLevel>9</JarCompressionLevel>
          
				<Debug/>
				<noThreadDebug/>
			</FileLoader>
		</driver>

		<size totalSize="5G"/>
		
		<accessControl default="None">
			<domain name="STARLASOFT" access="Write"/>
			<user name="gkspencer" access="Write"/>
			<gid id="101" access="Read"/>
			<uid id="102" access="Read"/>
			<address subnet="192.168.1.255" mask="255.255.255.0" access="Read"/>
			<address ip="192.168.1.2" access="Write"/>
			<protocol type="CIFS" access="Read"/>
		</accessControl>
	</diskshare>
-->
	  	  
	<diskshare name="JDBCBlob" comment="JDBC virtual filesystem using BLOB">
		<driver>
			<class>org.alfresco.jlan.server.filesys.db.DBDiskDriver</class>
			<CacheTime>300</CacheTime>
			<Debug/>
        
			<DatabaseInterface>
			  <class>org.alfresco.jlan.server.filesys.db.mysql.MySQLDBInterface</class>
			  <DSN>jdbc:mysql://localhost/JLAN</DSN>
			  <Username>jlan</Username>
			  <Password>roboter7</Password>
			  <ConnectionPool>10:20</ConnectionPool>
			  <FileSystemTable>filesys</FileSystemTable>
			  <StreamsTable>filestrm</StreamsTable>
			  <Debug/>
			  <SQLDebug/>
			</DatabaseInterface>
			
			<FileLoader>
				<class>org.alfresco.jlan.server.filesys.db.DBFileLoader</class>
				<ThreadPoolSize>6:2</ThreadPoolSize>
				<TempDirectory>/Volumes/Data/JLAN/jdbcMySQL</TempDirectory>
				<MaximumFilesPerDirectory>1000</MaximumFilesPerDirectory>
	
				<SmallFileSize>100K</SmallFileSize>
				<FilesPerJar>500</FilesPerJar>
				<SizePerJar>1000K</SizePerJar>
				<JarCompressionLevel>9</JarCompressionLevel>
			  
				<Debug/>
				<noThreadDebug/>
			</FileLoader>

		</driver>
	</diskshare>

  </shares>		

  <security>
    <JCEProvider>cryptix.jce.provider.CryptixCrypto</JCEProvider>

    <users>
      <user name="jlansrv">
        <password>jlan</password>
        <comment>System administrator</comment>
        <administrator/>
      </user>
		
      <user name="normal">
        <password>normal</password>
      </user>
    </users>
  </security>
</jlanserver>
